{
  "schema_version": 1,
  "repository": "NikaSir/ha-hikvision-next",
  "source_revision": "e16247b68202a44c37a01d16dbdcac555348c6d8",
  "kind": "ha_integration",
  "artifacts": [],
  "domain": "hikvision_next",
  "manifest_path": "custom_components/hikvision_next/manifest.json",
  "standards": {
    "applicable": false,
    "reason": "No NikaS frontend is registered in this repository.",
    "evidence_paths": [
      "custom_components/hikvision_next/__init__.py"
    ]
  },
  "publication": {
    "default_branch": "main",
    "github_releases": false,
    "automatic_tags": false
  },
  "observed_workflow_paths": [
    ".github/workflows/hacs.yml",
    ".github/workflows/testing.yml"
  ],
  "evidence": [
    {
      "requirement": "data_quality",
      "status": "pending",
      "paths": [
        "custom_components/hikvision_next/coordinator.py",
        "tests/test_coordinator.py",
        "tests/test_diagnostics.py"
      ],
      "note": "A13 production handling and executable regression coverage are present at the pinned main revision; controlled live polling-failure and recovery acceptance remains pending."
    },
    {
      "requirement": "command_safety",
      "status": "pending",
      "paths": [
        "custom_components/hikvision_next/notifications.py",
        "tests/test_notifications.py"
      ],
      "note": "A02 validates incoming event source addresses before accepting notification data and has regression coverage; live notification-path acceptance remains pending."
    },
    {
      "requirement": "lifecycle",
      "status": "pending",
      "paths": [
        "custom_components/hikvision_next/__init__.py",
        "tests/test_init.py"
      ],
      "note": "A14 preserves USER/DEVICE disabled ownership and only clears integration-owned disables; complete setup/unload/reconnect acceptance remains pending."
    },
    {
      "requirement": "repository_checks",
      "status": "pending",
      "paths": [
        ".github/workflows/hacs.yml",
        ".github/workflows/testing.yml",
        "tests/test_required_ci_gate.py",
        "tests/test_camera.py",
        "tests/test_config_flow.py",
        "tests/test_coordinator.py",
        "tests/test_diagnostics.py",
        "tests/test_init.py",
        "tests/test_isapi.py",
        "tests/test_notifications.py",
        "tests/test_pir.py",
        "tests/test_sensor.py",
        "tests/test_services.py",
        "tests/test_switch.py"
      ],
      "note": "Merged PR #4 makes validate an always-running, fail-closed aggregate of repository-checks (pytest) and hassfest in testing.yml. The old standalone Hassfest workflow is removed to keep validate unique; HACS Action remains independently required. Pytest now runs on pushes, PRs, the preserved daily schedule and manual dispatch. The dependency-free regression executes the actual gate and rejects unsuccessful or incomplete results. PR CI passed with 108 tests passed and 1 skipped. Existing A02/A13/A14 coverage remains present; CI is not promoted to production-runtime or device acceptance."
    },
    {
      "requirement": "device_acceptance",
      "status": "pending",
      "paths": [],
      "note": "No complete acceptance on the running user Home Assistant or target Hikvision hardware is recorded for this pinned revision."
    }
  ],
  "findings": [
    {
      "id": "A02",
      "requirement": "command_safety",
      "status": "fixed_pending_verification",
      "note": "PR #1 verifies notification source addresses before event routing; live device notification acceptance remains pending."
    },
    {
      "id": "A13",
      "requirement": "data_quality",
      "status": "fixed_pending_verification",
      "note": "PR #2 raises UpdateFailed on total supported polling failure and tracks partial sample quality; live failure/recovery acceptance remains pending."
    },
    {
      "id": "A14",
      "requirement": "lifecycle",
      "status": "fixed_pending_verification",
      "note": "PR #3 preserves USER/DEVICE disabled entities and only re-enables integration-owned disables; live setup/reload acceptance remains pending."
    },
    {
      "id": "A26",
      "requirement": "repository_checks",
      "status": "fixed_pending_verification",
      "note": "Pytest previously ran only on PRs and was outside the ruleset-required validate context. Merged PR #4 makes validate depend on repository-checks and hassfest, accepting only successful results, and adds post-merge test coverage on push. Required contexts remain HACS Action + validate. Ongoing governance verification and live Hikvision/Home Assistant acceptance remain pending; runtime/version 1.1.7 are unchanged."
    }
  ]
}
