{
  "schema_version": 1,
  "repository": "NikaSir/ha-nikas-access",
  "source_revision": "a3406417212e3f4de90d68d577174d53f81c9f8e",
  "kind": "ha_integration",
  "artifacts": [
    {
      "id": "panel",
      "path": "custom_components/nikas_access/frontend/nikas-access-panel.js",
      "ui_version": "0.1.10",
      "bindings": [
        {
          "role": "entrypoint",
          "path": "custom_components/nikas_access/panel.py",
          "pattern": "(?m)^\\s*(?:const\\s+)?PANEL_BUNDLE\\s*=\\s*[\\\"\\x27](?P<value>[^\\\"\\x27\\r\\n]+)[\\\"\\x27]",
          "expected": "nikas-access-panel.js",
          "path_mode": "basename"
        },
        {
          "role": "ui_version",
          "path": "custom_components/nikas_access/frontend/nikas-access-panel.js",
          "pattern": "(?m)^\\s*(?:const\\s+)?UI_VERSION\\s*=\\s*[\\\"\\x27](?P<value>[^\\\"\\x27\\r\\n]+)[\\\"\\x27]",
          "expected": "0.1.10"
        },
        {
          "role": "cache_key",
          "path": "custom_components/nikas_access/const.py",
          "pattern": "(?m)^\\s*(?:const\\s+)?VERSION\\s*=\\s*[\\\"\\x27](?P<value>[^\\\"\\x27\\r\\n]+)[\\\"\\x27]",
          "expected": "0.1.10"
        }
      ],
      "registration_evidence_paths": [
        "custom_components/nikas_access/__init__.py",
        "custom_components/nikas_access/panel.py"
      ],
      "binding_limitations": []
    }
  ],
  "domain": "nikas_access",
  "manifest_path": "custom_components/nikas_access/manifest.json",
  "standards": {
    "applicable": true,
    "reason": "Active NikaS panel UI.",
    "evidence_paths": [
      "custom_components/nikas_access/__init__.py"
    ],
    "declaration_path": ".nikas-ui-standard.json",
    "observed_version": "2.2",
    "required_version": "2.2"
  },
  "publication": {
    "default_branch": "main",
    "github_releases": false,
    "automatic_tags": false
  },
  "observed_workflow_paths": [
    ".github/workflows/validate.yml"
  ],
  "evidence": [
    {
      "requirement": "data_quality",
      "status": "pending",
      "paths": [],
      "note": "No complete acceptance evidence for the pinned production runtime is recorded. Existing tests are inventory only."
    },
    {
      "requirement": "command_safety",
      "status": "pending",
      "paths": [],
      "note": "No complete acceptance evidence for the pinned production runtime is recorded. Existing tests are inventory only."
    },
    {
      "requirement": "lifecycle",
      "status": "pending",
      "paths": [
        "tests/test_lifecycle_reconnect.py",
        "custom_components/nikas_access/frontend/src/nikas-access-panel.js",
        "custom_components/nikas_access/frontend/nikas-access-panel.js"
      ],
      "note": "A08 reconnect lifecycle reset plus A19 refresh/disconnect cleanup are covered at the pinned merged revision; live detach/reconnect acceptance remains open."
    },
    {
      "requirement": "repository_checks",
      "status": "pending",
      "paths": [
        ".github/workflows/validate.yml",
        "tests/frontend_model_harness.mjs",
        "tests/shell_v2_harness.mjs",
        "tests/test_command_safety.py",
        "tests/test_frontend_contract.py",
        "tests/test_lifecycle_reconnect.py",
        "tests/test_panel_registration.py",
        "tests/test_perimeter_safety.py",
        "tests/test_refresh_contract.py",
        "scripts/check-panel.mjs",
        "scripts/check_repository.py",
        "tests/test_python_syntax_validation.py",
        "tests/title_navigation.test.mjs"
      ],
      "note": "Merged PR #12 adds behavioral NikaS v2.2 and Refresh Action Contract regression coverage. Existing CI paths are code-side evidence only; running Home Assistant/iPhone acceptance remains separate. A32 merged PR #13 adds recursive Python syntax validation to the required repository checker, with mutation regressions for config_flow.py and nested modules. Post-merge validate passed; live/device acceptance remains pending. PR #14 implements Navigation Contract 1.3: main title opens /home/overview; internal pages use their own immediate parent. Query, storage, source hand-off, referrer and browser history cannot override title navigation. Repository validation is separate from live Home Assistant/device acceptance, which remains pending."
    },
    {
      "requirement": "device_acceptance",
      "status": "pending",
      "paths": [],
      "note": "No complete acceptance on the running user Home Assistant, iPhone, or target gateway hardware is recorded for this pinned revision."
    }
  ],
  "findings": [
    {
      "id": "A08",
      "requirement": "lifecycle",
      "status": "fixed_pending_verification",
      "note": "Merged PR #11 resets interrupted registry loading, transient command locks and canceled handles while preserving command cooldown; live reconnect acceptance remains pending."
    },
    {
      "id": "A19",
      "requirement": "standards",
      "status": "fixed_pending_verification",
      "note": "Merged PR #12 performs behavioral migration to NikaS UI Standard 2.2 / Navigation 1.2, including canonical Shell delivery and Refresh Action Contract v1.1; live panel acceptance remains pending."
    },
    {
      "id": "A32",
      "requirement": "repository_checks",
      "status": "fixed_pending_verification",
      "note": "Merged PR #13 prevents invalid integration Python from passing required validate by compiling every integration Python source without execution. Mutation regressions cover config_flow.py and nested modules. UI/integration 0.1.9 and runtime are unchanged; repository CI passed before and after merge, while live/device acceptance remains pending."
    },
    {
      "id": "NAV-1",
      "requirement": "repository_checks",
      "status": "fixed_pending_verification",
      "note": "PR #14 implements Navigation Contract 1.3: main title opens /home/overview; internal pages use their own immediate parent. Query, storage, source hand-off, referrer and browser history cannot override title navigation. Repository validation is separate from live Home Assistant/device acceptance, which remains pending."
    }
  ]
}
