{
  "schema_version": 1,
  "repository": "NikaSir/ha-keenetic-hero-4g",
  "source_revision": "40668e90b71484baba2dd2279aa1281e2be3cd8c",
  "kind": "ha_integration",
  "artifacts": [
    {
      "id": "panel",
      "path": "custom_components/keenetic_hero_4g/frontend/keenetic-panel-bundle.js",
      "ui_version": "1.0.12",
      "bindings": [
        {
          "role": "entrypoint",
          "path": "custom_components/keenetic_hero_4g/panel_runtime.py",
          "pattern": "f[\\\"\\x27]\\{_panel\\.PANEL_STATIC_URL\\}/(?P<value>[^\\\"\\x27?\\r\\n]+)\\?v=\\{FRONTEND_CACHE_KEY\\}",
          "expected": "keenetic-panel-bundle.js",
          "path_mode": "basename"
        },
        {
          "role": "ui_version",
          "path": "custom_components/keenetic_hero_4g/frontend/keenetic-panel-bundle.js",
          "pattern": "(?m)^\\s*(?:const\\s+)?K100_VERSION\\s*=\\s*[\\\"\\x27](?P<value>[^\\\"\\x27\\r\\n]+)[\\\"\\x27]",
          "expected": "1.0.12"
        },
        {
          "role": "cache_key",
          "path": "custom_components/keenetic_hero_4g/panel_runtime.py",
          "pattern": "(?m)^\\s*(?:const\\s+)?FRONTEND_CACHE_KEY\\s*=\\s*[\\\"\\x27](?P<value>[^\\\"\\x27\\r\\n]+)[\\\"\\x27]",
          "expected": "1.0.12"
        }
      ],
      "registration_evidence_paths": [
        "custom_components/keenetic_hero_4g/__init__.py",
        "custom_components/keenetic_hero_4g/panel_runtime.py",
        "custom_components/keenetic_hero_4g/panel.py"
      ],
      "binding_limitations": [
        "panel_runtime._select_frontend overrides legacy panel.PANEL_MODULE. Static binding inventories the override; behavioral proof of the selector and effective UI is pending."
      ]
    }
  ],
  "domain": "keenetic_hero_4g",
  "manifest_path": "custom_components/keenetic_hero_4g/manifest.json",
  "standards": {
    "applicable": true,
    "reason": "Active NikaS panel UI.",
    "evidence_paths": [
      "custom_components/keenetic_hero_4g/__init__.py"
    ],
    "declaration_path": ".nikas-ui-standard.json",
    "observed_version": "2.2",
    "required_version": "2.2"
  },
  "publication": {
    "default_branch": "main",
    "github_releases": false,
    "automatic_tags": false
  },
  "observed_workflow_paths": [
    ".github/workflows/frontend-bundle.yml",
    ".github/workflows/integration-validation.yml",
    ".github/workflows/release-tag.yml",
    ".github/workflows/repository-checks.yml"
  ],
  "evidence": [
    {
      "requirement": "data_quality",
      "status": "pending",
      "paths": [
        "custom_components/keenetic_hero_4g/coordinator.py",
        "custom_components/keenetic_hero_4g/wan.py",
        "tests/test_wan_contract.py"
      ],
      "note": "A15 production logic and executable WAN regression coverage are present at the pinned main revision; controlled live Ethernet/LTE switchover, unknown-gap and restart-boundary acceptance remains pending."
    },
    {
      "requirement": "command_safety",
      "status": "pending",
      "paths": [],
      "note": "No complete acceptance evidence for the pinned production runtime is recorded. Existing tests are inventory only."
    },
    {
      "requirement": "lifecycle",
      "status": "pending",
      "paths": [],
      "note": "No complete acceptance evidence for the pinned production runtime is recorded. Existing tests are inventory only."
    },
    {
      "requirement": "repository_checks",
      "status": "pending",
      "paths": [
        ".github/workflows/frontend-bundle.yml",
        ".github/workflows/integration-validation.yml",
        ".github/workflows/release-tag.yml",
        ".github/workflows/repository-checks.yml",
        "scripts/build_frontend_bundle.py",
        "tests/test_required_frontend_delivery.py",
        "tests/shell_v2_harness.mjs",
        "tests/test_module_bindings.py",
        "tests/test_panel_b054_overview_fit_system.py",
        "tests/test_panel_bottom_safe_area.py",
        "tests/test_panel_channel_status_fills_v105.py",
        "tests/test_panel_clean_rebuild.py",
        "tests/test_panel_composition_v078.py",
        "tests/test_panel_failover_idempotence.py",
        "tests/test_panel_fixed_chrome_v089.py",
        "tests/test_panel_full_height_header_zoom_v104.py",
        "tests/test_panel_header_return_v081.py",
        "tests/test_panel_header_safe_area.py",
        "tests/test_panel_overview_readability_v090.py",
        "tests/test_panel_overview_v082.py",
        "tests/test_panel_router_baseline_v086.py",
        "tests/test_panel_rules_117_rebuild.py",
        "tests/test_panel_safe_zoom.py",
        "tests/test_panel_shell_v22.py",
        "tests/test_panel_stability_mode.py",
        "tests/test_panel_stable_dom.py",
        "tests/test_panel_startup_wiring.py",
        "tests/test_panel_tab_transition.py",
        "tests/test_panel_tabs_viewport_v100.py",
        "tests/test_panel_target_composition_v088.py",
        "tests/test_panel_topology_layering.py",
        "tests/test_panel_ui_standard_v16.py",
        "tests/test_panel_zoom_contract.py",
        "tests/test_release_tag_contract.py",
        "tests/test_startup_lifecycle_contract.py",
        "tests/test_traffic_accounting.py",
        "tests/test_traffic_contract.py",
        "tests/test_wan_contract.py",
        "scripts/check_nikas_ui_standard.py",
        "scripts/check_standard_documents.py",
        "tests/test_standard_document_sync.py",
        "tests/header_parent_navigation.mjs"
      ],
      "note": "Merged PR #94 adds the existing deterministic autonomous bundle checker and NikaS standard checker to required validate. They previously ran only in the optional path-filtered frontend-bundle workflow, which retains the same commands. The builder checks exact source/bundle synchronization, runtime module statements, embedded CSS and Base64 image exclusions. The dependency-free regression exercises current, stale, missing and non-autonomous delivery. PR CI passed with 155 Python tests. A15 coverage remains present; repository CI is not promoted to live runtime/device acceptance. PR #95 synchronizes standard/navigation documents and adds an offline pinned-hash checker to required CI, rejecting document/declaration drift including coordinated rollback. Documentation parity is fixed; runtime conformance and device acceptance remain pending. PR #96 implements Navigation Contract 1.3: main title opens /home/overview; internal pages use their own immediate parent. Query, storage, source hand-off, referrer and browser history cannot override title navigation. Repository validation is separate from live Home Assistant/device acceptance, which remains pending."
    },
    {
      "requirement": "device_acceptance",
      "status": "pending",
      "paths": [],
      "note": "No complete acceptance on the running user Home Assistant, iPhone, or target gateway hardware is recorded for this pinned revision."
    }
  ],
  "findings": [
    {
      "id": "A15",
      "requirement": "data_quality",
      "status": "fixed_pending_verification",
      "note": "PR #93 selects WAN from factual route evidence, excludes explicitly down interfaces and keeps unknown intervals out of LTE duration; live failover/restart acceptance remains pending."
    },
    {
      "id": "A28",
      "requirement": "repository_checks",
      "status": "fixed_pending_verification",
      "note": "Merged PR #94 makes deterministic frontend delivery and NikaS standard validation part of the unfiltered required validate job. Required contexts remain validate + Hassfest + HACS. Ongoing governance verification and live Home Assistant/device acceptance remain pending. Runtime, UI 1.0.7 and integration version 1.0.0-b061 are unchanged."
    },
    {
      "id": "A41",
      "requirement": "repository_checks",
      "status": "fixed_pending_verification",
      "note": "PR #95 synchronizes standard/navigation documents and adds an offline pinned-hash checker to required CI, rejecting document/declaration drift including coordinated rollback. Documentation parity is fixed; runtime conformance and device acceptance remain pending."
    },
    {
      "id": "NAV-1",
      "requirement": "repository_checks",
      "status": "fixed_pending_verification",
      "note": "PR #96 implements Navigation Contract 1.3: main title opens /home/overview; internal pages use their own immediate parent. Query, storage, source hand-off, referrer and browser history cannot override title navigation. Repository validation is separate from live Home Assistant/device acceptance, which remains pending."
    }
  ]
}
