{
  "schema_version": 1,
  "repository": "NikaSir/ha-ho-sc-8w",
  "source_revision": "8e4e1bf755105a3bef88ca6bfa04175bc5c5d4c6",
  "kind": "ha_integration",
  "artifacts": [
    {
      "id": "panel",
      "path": "custom_components/nikas_ho_sc_8w/frontend/irrigation-panel.js",
      "ui_version": "1.1.1",
      "bindings": [
        {
          "role": "entrypoint",
          "path": "custom_components/nikas_ho_sc_8w/const.py",
          "pattern": "(?m)^PANEL_JS_URL\\s*=\\s*f[\\\"\\x27]\\{PANEL_STATIC_URL\\}/(?P<value>[^\\\"\\x27?\\r\\n]+)[\\\"\\x27]",
          "expected": "irrigation-panel.js",
          "path_mode": "basename"
        },
        {
          "role": "ui_version",
          "path": "custom_components/nikas_ho_sc_8w/frontend/irrigation-panel.js",
          "pattern": "(?m)^\\s*(?:const\\s+)?NIKAS_HO_SC_8W_UI_VERSION\\s*=\\s*[\\\"\\x27](?P<value>[^\\\"\\x27\\r\\n]+)[\\\"\\x27]",
          "expected": "1.1.1"
        },
        {
          "role": "cache_key",
          "path": "custom_components/nikas_ho_sc_8w/const.py",
          "pattern": "(?m)^\\s*(?:const\\s+)?PANEL_VERSION\\s*=\\s*[\\\"\\x27](?P<value>[^\\\"\\x27\\r\\n]+)[\\\"\\x27]",
          "expected": "1.1.1"
        }
      ],
      "registration_evidence_paths": [
        "custom_components/nikas_ho_sc_8w/frontend.py",
        "custom_components/nikas_ho_sc_8w/const.py",
        "custom_components/nikas_ho_sc_8w/__init__.py"
      ],
      "binding_limitations": []
    }
  ],
  "domain": "nikas_ho_sc_8w",
  "manifest_path": "custom_components/nikas_ho_sc_8w/manifest.json",
  "standards": {
    "applicable": true,
    "reason": "Active NikaS panel UI.",
    "evidence_paths": [
      "custom_components/nikas_ho_sc_8w/__init__.py"
    ],
    "declaration_path": ".nikas-ui-standard.json",
    "observed_version": "2.2",
    "required_version": "2.2"
  },
  "publication": {
    "default_branch": "main",
    "github_releases": true,
    "automatic_tags": true
  },
  "observed_workflow_paths": [
    ".github/workflows/publish-hacs-release.yml",
    ".github/workflows/repository-checks.yml"
  ],
  "evidence": [
    {
      "requirement": "data_quality",
      "status": "pending",
      "paths": [],
      "note": "A06 code and executable recovery scenarios are present at the pinned revision; controlled live transport acceptance remains open."
    },
    {
      "requirement": "command_safety",
      "status": "pending",
      "paths": [],
      "note": "A01 current Manual-session ownership checks are present at the pinned revision; complete device command acceptance remains open."
    },
    {
      "requirement": "lifecycle",
      "status": "pending",
      "paths": [],
      "note": "Reconnect and loss-of-connection recovery require controlled behavioral acceptance on the pinned runtime."
    },
    {
      "requirement": "repository_checks",
      "status": "pending",
      "paths": [
        ".github/workflows/publish-hacs-release.yml",
        ".github/workflows/repository-checks.yml",
        "scripts/check-control-contract-b00587.py",
        "scripts/check-control-contract.py",
        "scripts/check-manual-session-adapters.py",
        "scripts/check-manual-skip-contract.py",
        "scripts/check-local-transport-recovery.py",
        "scripts/check-panel-ui-v16.mjs",
        "scripts/check-zone7-anchor-date-probe.py",
        "scripts/check-zone7-parity-probe.py",
        "scripts/check-zone7-parity-ui.mjs",
        "scripts/check-zone8-dp38-contract.py",
        "scripts/check_nikas_ui_standard.py",
        "scripts/check-zone-schedule-summary-ui.mjs",
        "tests/test_title_parent.cjs"
      ],
      "note": "Merged PR #178 adds zone schedule summary rendering regressions to required validate at the pinned production revision (integration 1.0.4 / UI 1.0.3). Post-merge validate, HACS, Hassfest and publication succeeded; GitHub Release 1.0.4 targets this revision. These are code/publication observations only, not proof of HACS installation or live/device acceptance. PR #182 implements Navigation Contract 1.3: main title opens /home/overview; internal pages use their own immediate parent. Query, storage, source hand-off, referrer and browser history cannot override title navigation. Repository validation is separate from live Home Assistant/device acceptance, which remains pending."
    },
    {
      "requirement": "device_acceptance",
      "status": "pending",
      "paths": [],
      "note": "No complete acceptance on the running user Home Assistant, iPhone, or target gateway hardware is recorded for this pinned revision."
    }
  ],
  "findings": [
    {
      "id": "A01",
      "requirement": "command_safety",
      "status": "fixed_pending_verification",
      "note": "PR #168 binds skip to the confirmed current Manual session; live device acceptance remains pending."
    },
    {
      "id": "A06",
      "requirement": "data_quality",
      "status": "fixed_pending_verification",
      "note": "PR #176 closes the local socket and publishes offline after repeated TinyTuya Error/Err responses; live transport acceptance remains pending."
    },
    {
      "id": "A07",
      "requirement": "artifact_autonomy",
      "status": "fixed_pending_verification",
      "note": "PR #173 makes irrigation-panel.js the autonomous production bundle and checks that it has no historical runtime imports; browser acceptance remains pending."
    },
    {
      "id": "A22",
      "requirement": "publication",
      "status": "fixed_pending_verification",
      "note": "Owner-approved policy publishes stable manifest versions through an idempotent HACS Release workflow and skips prereleases; end-to-end HACS delivery acceptance remains pending."
    },
    {
      "id": "A19",
      "requirement": "standards",
      "status": "fixed_pending_verification",
      "note": "PR #177 aligns the declaration, canonical documents and production bundle with UI Standard 2.2; live HA/browser/iPhone behavior acceptance remains pending."
    },
    {
      "id": "NAV-1",
      "requirement": "repository_checks",
      "status": "fixed_pending_verification",
      "note": "PR #182 implements Navigation Contract 1.3: main title opens /home/overview; internal pages use their own immediate parent. Query, storage, source hand-off, referrer and browser history cannot override title navigation. Repository validation is separate from live Home Assistant/device acceptance, which remains pending."
    }
  ]
}
