{
  "schema_version": 1,
  "repository": "NikaSir/ha-s8-omni",
  "source_revision": "0780c62f793f95bd941d4b377dfcf2724168342e",
  "kind": "ha_integration",
  "artifacts": [
    {
      "id": "panel",
      "path": "custom_components/s8_omni/frontend/s8-omni-production.js",
      "ui_version": "v1.0.8",
      "bindings": [
        {
          "role": "entrypoint",
          "path": "custom_components/s8_omni/__init__.py",
          "pattern": "(?m)^PANEL_MODULE\\s*=\\s*f[\\\"\\x27]\\{PANEL_STATIC_URL\\}/(?P<value>[^\\\"\\x27?\\r\\n]+)\\?v=",
          "expected": "s8-omni-production.js",
          "path_mode": "basename"
        },
        {
          "role": "ui_version",
          "path": "custom_components/s8_omni/frontend/s8-omni-panel.js",
          "pattern": "(?m)^\\s*(?:const\\s+)?UI_VERSION\\s*=\\s*[\\\"\\x27](?P<value>[^\\\"\\x27\\r\\n]+)[\\\"\\x27]",
          "expected": "v1.0.8"
        },
        {
          "role": "cache_key",
          "path": "custom_components/s8_omni/const.py",
          "pattern": "(?m)^\\s*(?:const\\s+)?DASHBOARD_VERSION\\s*=\\s*[\\\"\\x27](?P<value>[^\\\"\\x27\\r\\n]+)[\\\"\\x27]",
          "expected": "v1.0.8"
        }
      ],
      "registration_evidence_paths": [
        "custom_components/s8_omni/__init__.py",
        "custom_components/s8_omni/const.py"
      ],
      "binding_limitations": []
    }
  ],
  "domain": "s8_omni",
  "manifest_path": "custom_components/s8_omni/manifest.json",
  "standards": {
    "applicable": true,
    "reason": "Active NikaS panel UI.",
    "evidence_paths": [
      "custom_components/s8_omni/__init__.py"
    ],
    "declaration_path": ".nikas-ui-standard.json",
    "observed_version": "2.2",
    "required_version": "2.2"
  },
  "publication": {
    "default_branch": "main",
    "github_releases": true,
    "automatic_tags": false
  },
  "observed_workflow_paths": [
    ".github/workflows/repository-checks.yml"
  ],
  "evidence": [
    {
      "requirement": "data_quality",
      "status": "pending",
      "paths": [
        "custom_components/s8_omni/frontend/s8-omni-panel.js",
        "custom_components/s8_omni/frontend/s8-omni-service-settings.js",
        "tests/test_command_readback_b096.py"
      ],
      "note": "A05 production behavior remains present at the pinned main revision: missing/unavailable/malformed control values stay unknown rather than being coerced to 0/false, and confirmation requires valid target readback. Hardware/Home Assistant acceptance remains pending."
    },
    {
      "requirement": "command_safety",
      "status": "pending",
      "paths": [
        "custom_components/s8_omni/frontend/s8-omni-panel.js",
        "custom_components/s8_omni/frontend/s8-omni-service-settings.js",
        "tests/test_command_readback_b096.py",
        "tests/test_mode_write_guard_b079.py"
      ],
      "note": "PR #123 requires valid available target evidence, matching same-target readback and advancing target telemetry before confirming a setting; zero/off drafts are no longer falsely acknowledged. Device acceptance remains pending."
    },
    {
      "requirement": "lifecycle",
      "status": "pending",
      "paths": [],
      "note": "No complete acceptance evidence for the pinned production runtime is recorded. Existing tests are inventory only."
    },
    {
      "requirement": "repository_checks",
      "status": "pending",
      "paths": [
        ".github/workflows/repository-checks.yml",
        "scripts/build_s8_production.py",
        "tests/test_autonomous_production_bundle.py",
        "tests/test_required_hacs_gate.py",
        "tests/test_command_readback_b096.py",
        "tests/test_diagnostic_protocol_fixes_v0734.py",
        "tests/test_mode_write_guard_b079.py",
        "tests/test_panel_cleaning_ui_v0732.py",
        "tests/test_panel_current_rules_ui_v0733.py",
        "tests/test_panel_dynamic_actions_ui_v0723.py",
        "tests/test_panel_mobile_audit_ui_v0729.py",
        "tests/test_panel_mobile_shell_ui_v0721.py",
        "tests/test_panel_overview_ui_v0727.py",
        "tests/test_panel_stable_dom_ui_v0720.py",
        "tests/test_panel_state_transition_grid_ui_v0728.py",
        "tests/test_panel_ui_standard_v16_v0722.py",
        "tests/test_panel_ui_standard_v17_v0730.py",
        "tests/test_pause_dp2_only_b083.py",
        "tests/test_protocol_capture_v0737.py",
        "tests/test_return_via_pause_release_b084.py",
        "tests/test_return_wait_for_standby_b080.py",
        "tests/test_station_stop_b081.py",
        "tests/test_verified_drying_stop_v0739.py",
        "scripts/check_nikas_ui_standard.py",
        "scripts/check_standard_documents.py",
        "tests/test_standard_document_sync.py",
        "tests/test_title_parent.cjs"
      ],
      "note": "Merged PR #131 makes the ruleset-required validate context an always-running, fail-closed aggregate of repository-checks and hacs-validation. Required contexts remain validate + browser-regression; browser-regression stays independently required. The dependency-free gate regression executes the actual workflow script and rejects unsuccessful or incomplete results. PR and post-merge main CI passed. PR #130 autonomous production-bundle and A05 coverage remain present. Hardware/Home Assistant/iPhone acceptance remains separate. PR #133 synchronizes standard/navigation documents and adds an offline pinned-hash checker to required CI, rejecting document/declaration drift including coordinated rollback. Documentation parity is fixed; runtime conformance and device acceptance remain pending. Production 1.0.6 from PR #132 is preserved; the document-only PR #133 does not certify its desktop indicator behavior. PR #134 implements Navigation Contract 1.3: main title opens /home/overview; internal pages use their own immediate parent. Query, storage, source hand-off, referrer and browser history cannot override title navigation. Repository validation is separate from live Home Assistant/device acceptance, which remains pending. 2026-09-14 fleet maintenance: PR #136 adds Hassfest to the fail-closed validate aggregate alongside repository-checks and HACS. Browser regression remains independently required. Manifest key ordering is normalized without changing version or behavior. Post-merge required CI passed; hardware acceptance remains pending."
    },
    {
      "requirement": "device_acceptance",
      "status": "pending",
      "paths": [],
      "note": "No complete acceptance on the running user Home Assistant, iPhone, or target S8 OMNI hardware is recorded for this pinned revision."
    }
  ],
  "findings": [
    {
      "id": "A05",
      "requirement": "command_safety",
      "status": "fixed_pending_verification",
      "note": "PR #123 preserves unknown/missing control values and requires valid same-target readback before command confirmation; hardware/Home Assistant acceptance remains pending."
    },
    {
      "id": "REG-S8-IMPORTS",
      "requirement": "artifact_autonomy",
      "status": "fixed_pending_verification",
      "note": "Merged PR #130 changes Home Assistant registration to deterministic autonomous s8-omni-production.js and rejects runtime JS import chains; field acceptance remains pending."
    },
    {
      "id": "A24",
      "requirement": "repository_checks",
      "status": "fixed_pending_verification",
      "note": "HACS previously ran outside the required validate context. Merged PR #131 makes validate depend on repository-checks and hacs-validation and fail unless both succeed, including failure, cancelled, skipped and missing-result cases. The ruleset retains validate + browser-regression. Post-merge CI passed at the pinned production SHA; ongoing governance verification and device acceptance remain pending. UI/runtime/version 1.0.5 are unchanged."
    },
    {
      "id": "A42",
      "requirement": "repository_checks",
      "status": "fixed_pending_verification",
      "note": "PR #133 synchronizes standard/navigation documents and adds an offline pinned-hash checker to required CI, rejecting document/declaration drift including coordinated rollback. Documentation parity is fixed; runtime conformance and device acceptance remain pending."
    },
    {
      "id": "NAV-1",
      "requirement": "repository_checks",
      "status": "fixed_pending_verification",
      "note": "PR #134 implements Navigation Contract 1.3: main title opens /home/overview; internal pages use their own immediate parent. Query, storage, source hand-off, referrer and browser history cannot override title navigation. Repository validation is separate from live Home Assistant/device acceptance, which remains pending."
    }
  ]
}
