{
  "schema_version": 1,
  "repository": "NikaSir/ha-zont",
  "source_revision": "012d1841b7aeee0c6bf40079e61dddabd5840e12",
  "kind": "ha_integration",
  "artifacts": [
    {
      "id": "panel",
      "path": "custom_components/zont_local/frontend/zont-ui.js",
      "ui_version": "0.9.6",
      "bindings": [
        {
          "role": "entrypoint",
          "path": "custom_components/zont_local/const.py",
          "pattern": "(?m)^\\s*(?:const\\s+)?FRONTEND_FILENAME\\s*=\\s*[\\\"\\x27](?P<value>[^\\\"\\x27\\r\\n]+)[\\\"\\x27]",
          "expected": "zont-ui.js",
          "path_mode": "basename"
        },
        {
          "role": "ui_version",
          "path": "custom_components/zont_local/frontend/zont-ui.js",
          "pattern": "(?m)^\\s*(?:const\\s+)?UI_VERSION\\s*=\\s*[\\\"\\x27](?P<value>[^\\\"\\x27\\r\\n]+)[\\\"\\x27]",
          "expected": "0.9.6"
        },
        {
          "role": "cache_key",
          "path": "custom_components/zont_local/const.py",
          "pattern": "(?m)^\\s*(?:const\\s+)?VERSION\\s*=\\s*[\\\"\\x27](?P<value>[^\\\"\\x27\\r\\n]+)[\\\"\\x27]",
          "expected": "0.9.6"
        }
      ],
      "registration_evidence_paths": [
        "custom_components/zont_local/__init__.py",
        "custom_components/zont_local/const.py"
      ],
      "binding_limitations": []
    }
  ],
  "domain": "zont_local",
  "manifest_path": "custom_components/zont_local/manifest.json",
  "standards": {
    "applicable": true,
    "reason": "Active NikaS panel UI.",
    "evidence_paths": [
      "custom_components/zont_local/__init__.py"
    ],
    "declaration_path": ".nikas-ui-standard.json",
    "observed_version": "2.2",
    "required_version": "2.2"
  },
  "publication": {
    "default_branch": "main",
    "github_releases": false,
    "automatic_tags": false
  },
  "observed_workflow_paths": [
    ".github/workflows/integration-validation.yml"
  ],
  "evidence": [
    {
      "requirement": "data_quality",
      "status": "pending",
      "paths": [
        "custom_components/zont_local/frontend/zont-app.js",
        "tests/test_zont_dhw_truth.cjs",
        "tests/test_zont_ui_semantics.cjs"
      ],
      "note": "A16 truth-preserving DHW and transport semantics plus executable runtime scenarios are present at the pinned revision; live ZONT/device acceptance remains open."
    },
    {
      "requirement": "command_safety",
      "status": "pending",
      "paths": [],
      "note": "No complete acceptance evidence for the pinned production runtime is recorded. Existing tests are inventory only."
    },
    {
      "requirement": "lifecycle",
      "status": "pending",
      "paths": [],
      "note": "No complete acceptance evidence for the pinned production runtime is recorded. Existing tests are inventory only."
    },
    {
      "requirement": "repository_checks",
      "status": "pending",
      "paths": [
        ".github/workflows/integration-validation.yml",
        "tests/shell_v2_harness.mjs",
        "tests/test_panel_registration.py",
        "tests/test_zont_dhw_truth.cjs",
        "tests/test_zont_shell_v22.py",
        "tests/test_zont_ui_semantics.cjs",
        "scripts/check_nikas_ui_standard.py",
        "scripts/check_standard_documents.py",
        "tests/test_standard_document_sync.py"
      ],
      "note": "PR #32 CI covered full-runtime DHW semantics, shell checks, HACS and Hassfest at the merged lineage; running Home Assistant and target-device acceptance remain separate evidence. PR #33 synchronizes standard/navigation documents and adds an offline pinned-hash checker to required CI, rejecting document/declaration drift including coordinated rollback. Documentation parity is fixed; runtime conformance and device acceptance remain pending."
    },
    {
      "requirement": "device_acceptance",
      "status": "pending",
      "paths": [],
      "note": "No complete acceptance on the running user Home Assistant, iPhone, or target gateway hardware is recorded for this pinned revision."
    }
  ],
  "findings": [
    {
      "id": "A16",
      "requirement": "data_quality",
      "status": "fixed_pending_verification",
      "note": "Merged PR #32 preserves missing numeric/transport truth, separates DHW readiness, permission and actual heating, and adds full-runtime regression coverage; live device acceptance remains pending."
    },
    {
      "id": "A45",
      "requirement": "repository_checks",
      "status": "fixed_pending_verification",
      "note": "PR #33 synchronizes standard/navigation documents and adds an offline pinned-hash checker to required CI, rejecting document/declaration drift including coordinated rollback. Documentation parity is fixed; runtime conformance and device acceptance remain pending."
    }
  ]
}
